{
  "version": "1.0",
  "project_id": "study-01-argon-motion",
  "pipeline_type": "animated-explainer",
  "stage": "compose",
  "status": "completed",
  "timestamp": "2026-10-20T14:15:30.184582+00:00",
  "checkpoint_policy": "guided",
  "human_approval_required": false,
  "human_approved": false,
  "artifacts": {
    "render_report": {
      "version": "1.0",
      "outputs": [
        {
          "path": "renders/argon-motion-v1.mp4",
          "format": "mp4",
          "codec": "h264",
          "resolution": "1920x1080",
          "fps": 30,
          "duration_seconds": 30,
          "file_size_bytes": 15666026
        }
      ],
      "render_time_seconds": 69.5,
      "render_grammar": "animation-first",
      "verification_notes": [
        "HyperFrames 0.8.174; 900 frames; local hardware browser capture; 2 workers.",
        "Lint: 0 errors, 7 organizational suggestions to split into sub-compositions.",
        "Runtime validate: 0 errors; 0 contrast failures.",
        "Inspect: 0 errors; intentional off-canvas ambient glow warnings.",
        "12 pre-render snapshot times reviewed; 10 frames from final MP4 reviewed.",
        "Full MP4 decoded by ffmpeg with no errors. ffprobe confirms 30 seconds, 1080p, 30 fps.",
        "Silent version as approved. Reference imagery and final movie excerpt are reused."
      ],
      "decision_log_ref": "artifacts/decision_log.json",
      "final_review_ref": "artifacts/final_review.json"
    },
    "final_review": {
      "version": "1.0",
      "output_path": "renders/argon-motion-v1.mp4",
      "status": "pass",
      "checks": {
        "technical_probe": {
          "valid_container": true,
          "duration_seconds": 30,
          "resolution": "1920x1080",
          "fps": 30,
          "has_audio": false,
          "codec": "h264",
          "file_size_bytes": 15666026,
          "issues": []
        },
        "visual_spotcheck": {
          "frames_sampled": 10,
          "frame_paths": [
            "renders/contact-sheet.jpg"
          ],
          "black_frames_detected": false,
          "broken_overlays": false,
          "missing_assets": false,
          "unreadable_text": false,
          "issues": []
        },
        "audio_spotcheck": {
          "narration_present": false,
          "music_present": false,
          "unexpected_silence": false,
          "issues": []
        },
        "promise_preservation": {
          "delivery_promise_honored": true,
          "render_runtime_used": "hyperframes",
          "runtime_swap_detected": false,
          "silent_downgrade_detected": false,
          "runtime_swap_check": "Matches explicit user selection and decision d-001.",
          "issues": []
        },
        "subtitle_check": {
          "subtitles_expected": true,
          "subtitles_present": true,
          "timing_drift_detected": false,
          "issues": []
        }
      },
      "issues_found": [],
      "recommended_action": "present_to_user",
      "metadata": {
        "verification_scope": "Local render, full decoding, metadata and sampled visual inspection; not provider testing.",
        "limitations": "Inter approximates the reference font; preview UI is retained in source imagery; no audio.",
        "paid_generation_usd": 0,
        "user_final_visual_acceptance": "pending"
      }
    }
  }
}